{
  "schema": "die.factory-asset.asset-blueprint.v2",
  "distinctness": {
    "identity_rule": "DISTINCT_COMMERCIAL_USE_CASE_AND_BLUEPRINT",
    "packaging_variants_create_new_semantic_asset": false,
    "near_duplicate_action": "QUARANTINE"
  },
  "rights": {
    "commercial_use_cleared": true,
    "trademark_free": true,
    "recognizable_person_or_property": false,
    "release_state": "NOT_REQUIRED"
  },
  "policy": {
    "compatibility_state": "COMPATIBLE",
    "marketplace_profiles": [
      "ADOBE_STOCK"
    ],
    "unknown_policy_action": "BLOCK_SUBMISSION",
    "submission_authority": "FOUNDER_CONTROLLED"
  },
  "blueprint_id": "FABP-SHOPPING_BAG_OUTLINE",
  "semantic_identity": {
    "semantic_asset_id": "FASA-SHOPPING_BAG_OUTLINE",
    "commercial_use_case": "editable shopping bag outline symbol for instruction graphics and interface iconography",
    "subject": "shopping bag",
    "intent": "DESIGN_COMPONENT"
  },
  "asset_type": "OUTLINE",
  "native_representation": "VECTOR_PATHS",
  "producer_class": "NATIVE_VECTOR",
  "master_spec": {
    "format": "SVG",
    "color_space": "SRGB",
    "lineage_sha256_required": true
  },
  "derivatives": [
    {
      "derivative_id": "ADOBE_SVG",
      "purpose": "MARKETPLACE_DELIVERY",
      "format": "SVG",
      "semantic_identity_effect": "NONE"
    },
    {
      "derivative_id": "PNG_PREVIEW",
      "purpose": "PREVIEW",
      "format": "PNG",
      "semantic_identity_effect": "NONE"
    }
  ],
  "quality": {
    "magic_mime_match": true,
    "decode_reopen": true,
    "lineage_sha256": true,
    "family_checks": [
      "VECTOR_PATHS_PRESENT",
      "NO_EMBEDDED_RASTER_ONLY",
      "VIEWBOX_BOUNDS",
      "PATH_COMPLEXITY"
    ]
  }
}
